{
  "schemaVersion": 1,
  "id": "TASK-DEMO-A",
  "parentId": null,
  "order": 0,
  "title": "샘플 프로젝트 A",
  "category": "project",
  "status": "in_progress",
  "progress": 50,
  "startDate": "2026-09-01",
  "targetEndDate": "2026-11-30",
  "actualEndDate": null,
  "summary": "기능 체험용 가상 프로젝트입니다. 실제 업무와 무관합니다.",
  "tags": [
    "샘플"
  ],
  "owners": [
    "나"
  ],
  "links": [],
  "bodyFile": "notes/TASK-DEMO-A.md",
  "images": [],
  "milestones": [
    {
      "id": "MS-TASK-DEMO-A",
      "title": "중간 점검",
      "date": "2026-09-25",
      "status": "planned",
      "description": "일정 및 완료 기준을 함께 확인합니다."
    }
  ],
  "logs": [
    {
      "id": "LOG-TASK-DEMO-A",
      "at": "2026-09-10T09:00:00+09:00",
      "type": "development",
      "title": "샘플 작업 등록",
      "content": "실제 업무명과 내부 자료가 없는 공개 데모입니다.",
      "tags": []
    }
  ],
  "decisions": [
    {
      "id": "DEC-TASK-DEMO-A",
      "date": "2026-09-10",
      "title": "작업 분할",
      "decision": "작은 작업 단위로 나누어 관리합니다.",
      "reason": "진행 상황을 쉽게 확인하기 위해서입니다.",
      "alternatives": [],
      "impact": "하위 작업 진행률을 상위 과제에 집계합니다."
    }
  ],
  "releases": [
    {
      "id": "REL-TASK-DEMO-A",
      "title": "첫 번째 검토본",
      "version": "0.1.0",
      "releaseDate": "2026-11-30",
      "status": "planned",
      "summary": "샘플 릴리즈 계획",
      "notes": [
        "기능 검토",
        "가이드 확인"
      ]
    }
  ],
  "history": [],
  "archived": false,
  "createdAt": "2026-09-10T00:00:00Z",
  "updatedAt": "2026-09-10T00:00:00Z"
}
